[
  {
    "id": "src_demo_101",
    "title": "Daily Watch Demo Source Plan",
    "type": "note",
    "source": "manual-curation",
    "path": "inbox/2026-04-26-source-plan.md",
    "url": "",
    "collectedAt": "2026-04-26T13:00:00+09:00",
    "status": "organized",
    "tags": ["daily", "watch", "demo"]
  }
]
